companyid,companyname,companyalsoknownas,companyformername,companylegalname,description,keywords,companyfinancingstatus,companyfinancingstatusdate,totalraised,totalraisednativeamount,totalraisednativecurrency,businessstatus,businessstatusdate,ownershipstatus,ownershipstatusdate,universe,website,employees,employeeasofdate,descriptionshort,exchange,ticker,yearfounded,parentcompany,parentcompanyid,toplevelparent,toplevelparentid,cikcode,morningstarid,primaryindustrysector,primaryindustrygroup,primaryindustrycode,allindustries,verticals,emergingspaces,hqlocation,hqaddressline1,hqaddressline2,hqcity,hqstate_province,hqpostcode,hqcountry,hqphone,hqfax,hqemail,hqglobalregion,hqglobalsubregion,alternateofficecount,activeinvestors,formerinvestors,revenue,grossprofit,netincome,enterprisevalue,ebitda,ebit,netdebt,fiscalperiod,periodenddate,firstfinancingdealid,firstfinancingdate,firstfinancingsize,firstfinancingsizestatus,firstfinancingvaluation,firstfinancingvaluationstatus,firstfinancingdealtype,firstfinancingdealtype2,firstfinancingdealtype3,firstfinancingdealclass,firstfinancingdebt,firstfinancingdebtsize,firstfinancingdebtdate,firstfinancingstatus,lastknownvaluation,lastknownvaluationdate,lastknownvaluationdealtype,lastfinancingdealid,lastfinancingdate,lastfinancingsize,lastfinancingsizestatus,lastfinancingvaluation,lastfinancingvaluationstatus,lastfinancingdealtype,lastfinancingdealtype2,lastfinancingdealtype3,lastfinancingdealclass,lastfinancingdebt,lastfinancingdebtsize,lastfinancingdebtdate,lastfinancingstatus,financingstatusnote,facebookprofileurl,twitterprofileurl,linkedinprofileurl,profiledatasource,pitchbookprofilelink,pitchbookcreateddate,rowid,lastupdated
160988-14,CyberQ Group,,,CyberQ Group Ltd.,"Developer of a digital security technology designed to detect and combat online threats. The company's platform leverages machine learning and specializes in penetration testing, threat monitoring, online risk assessments, digital human reconnaissance, due diligence, and smart building assurance, enabling clients to ensure optimal system and information security.","anomaly detection, big data platform, cyber protection, cyber threat, managed security services, threat detection, threat monitoring",Venture Capital-Backed,2026-03-16,4.1106313,3.15611917,GBP,Generating Revenue,2016-05-12,Privately Held (backing),2016-05-12,Venture Capital,www.cyberqgroup.com,6,2024-12-31,Developer of a digital security technology designed to detect and combat online threats.,,,2015,,,,,,,Information Technology,Software,Network Management Software,"IT Consulting and Outsourcing, Network Management Software","Artificial Intelligence & Machine Learning, Big Data, Cybersecurity",Digital Avatars,"Birmingham, United Kingdom","Alpha Tower, Alpha Works","21st Floor, Suffolk Street, Queensway, West Midlands",Birmingham,England,B1 1TT,United Kingdom,+44 (0)80 0061 4725,+44 (0)80 0061 4715,theteam@cyberqgroup.com,Europe,Western Europe,7,6,,,,,,,,0.03444633,TTM 4Q2024,2024-12-31,71386-57T,2016-05-12,,,,,Accelerator/Incubator,,,Other,,,2016-05-12,Completed,4.32380195,2021-02-26,Later Stage VC,325013-41T,2026-03-16,,,,,Accelerator/Incubator,,,Other,,,2026-03-16,Completed,"The company joined Grow London as a part of seventh cohort of Grow London Global on March 16, 2026. No equity or funding was exchanged as a result of this program.",https://www.facebook.com/cyberqgroup,https://twitter.com/CyberQ_Group,https://www.linkedin.com/company/cyberqgroup,PitchBook Research,https://content.pitchbook.com/profiles/company/160988-14,2016-06-12,23ed1124e4fd1ea4fbdb1c1b82811b0bbc0b96ea59e855bb4afd71bbd29da134,2026-03-25
432873-10,Metcloud,MET,,Managed Enterprise Technologies Ltd.,"Developer of a cybersecurity cloud platform intended to support the digital landscape. The company's platform offers cyber defense, surveillance, artificial intelligence and machine learning technologies and other cloud computing needs, enabling clients to get improved security without hampering efficiency and efficacy.","business continuity services, cloud backup service, cloud protection, cloud services, cyber safety, data security, database loss prevention, firewall protection, hybrid cloud",Private Equity-Backed,2021-09-15,,,,Generating Revenue,2020-03-03,Privately Held (backing),2020-03-03,"Private Equity, Venture Capital",www.metcloud.com,21,2025-12-09,Developer of a cybersecurity cloud platform intended to support the digital landscape.,,,1998,,,,,,,Information Technology,Software,Network Management Software,"IT Consulting and Outsourcing, Network Management Software","Artificial Intelligence & Machine Learning, Cybersecurity, SaaS",,"Birmingham, United Kingdom",Lyndon House,62 Hagley Road,Birmingham,England,B16 8PE,United Kingdom,+44 (0)12 1227 0730,,hello@metcloud.com,Europe,Western Europe,,5,,,,,,,,0.03535325,TTM 4Q2025,2025-03-31,288821-89T,,,,,,Accelerator/Incubator,,,Other,,,,Completed,,,,184386-52T,2021-09-15,,,,,PE Growth/Expansion,,,Private Equity,,,2021-09-15,Completed,"The company received an undisclosed amount of development capital from Future Planet Capital and Midven on September 15, 2021. The funds will be used to accelerate growth by increasing sales and marketing capacity, as well as multiple technical hires to strengthen depth and capability within the team.",https://www.facebook.com/METCLOUD,https://twitter.com/METCloud_com,https://www.linkedin.com/company/metcloud,PitchBook Research,https://content.pitchbook.com/profiles/company/432873-10,2020-03-03,9f765b3a84459f8499c479e8ed1efaec6499bc2f090ff20c4cf5a39ee2e5ed06,2026-03-25
439217-65,Utility Stream,USL,,Utility Stream Limited.,"Provider of energy consulting services designed to create a sustainable environment for businesses. The company's services include complete account management and bill validation, procurement procedure, identifying, proposing, and incorporating energy management services, and ultimately a strategy to reduce energy usage, enabling companies to save money and reduce their carbon footprint.","carbon footprint reduction, carbon management, consulting firm, energy consulting service, energy management, energy monitoring, renewable energy",Venture Capital-Backed,2022-06-09,0.30212222,0.225,GBP,Generating Revenue,2020-09-10,Privately Held (backing),2020-09-10,Venture Capital,www.utility-stream.com,23,2025-11-10,Provider of energy consulting services designed to create a sustainable environment for businesses.,,,2018,,,,,,,Energy,Energy Services,Energy Marketing,"Energy Marketing, Environmental Services (B2B)","CleanTech, Climate Tech, LOHAS & Wellness",,"Warwick, United Kingdom","4 Pegasus House, Pegasus Court",Tachbrook Park,Warwick,England,CV34 6LW,United Kingdom,+44 (0)19 2693 5343,,hello@utility-stream.com,Europe,Western Europe,,4,,,,,,,,0.01676391,TTM 4Q2024,2024-12-31,156245-14T,2020-09-10,0.19767039,Actual,0.79068155,Actual,Early Stage VC,,,Venture Capital,,,2020-09-10,Completed,1.56579142,2021-07-08,Early Stage VC,214163-56T,2022-06-09,,,,,Early Stage VC,,,Venture Capital,Bridge Loan (Convertible),,2022-06-09,Completed,"The company raised an undisclosed amount of venture funding in the form of convertible debt from UK Innovation & Science Seed Fund, Future Planet Capital and Midven on June 9, 2022.",https://www.facebook.com/utilitystream,https://twitter.com/utilitystream1,https://www.linkedin.com/company/utility-stream-limited,PitchBook Research,https://content.pitchbook.com/profiles/company/439217-65,2020-09-17,d44adbfa6fbb38df8b23eaa1efc8f5ad4fadaf0bc9b8ca299dd2ba2ad3fe9330,2026-03-25
443170-45,D-RisQ,,,Drisq Ltd,"Developer and seller of automated software development tools designed to reduce costs and create a secure way of working. The company utilizes formal methods of mathematical technology the suite of tools automates the process of verifying the software from design to object code, alleviating much of the need for test and deployment of highly trained software engineers, enabling businesses to comply with the regulatory standards at an affordable cost and time of traditional review and test methods.","automated software product, automated software solutions, automated software tools, automatic verification, behavioural analytics, cyber security protection, devops security platform, software products, verification system",Venture Capital-Backed,2025-07-13,0.71646898,0.544002,GBP,Generating Revenue,2020-10-27,Privately Held (backing),2014-08-01,Venture Capital,www.drisq.com,14,2025-03-31,Developer and seller of automated software development tools designed to reduce costs and create a secure way of working.,,,2011,,,,,,,Information Technology,Software,Software Development Applications,"Business/Productivity Software, Network Management Software, Software Development Applications",Cybersecurity,DevSecOps,"Malvern, United Kingdom",Malvern Science Park,"Geraldine Road, Malvern, Worcestershire",Malvern,England,WR14 3SZ,United Kingdom,+44 (0)16 8425 2452,,info@drisq.com,Europe,Western Europe,,7,,,,,,,,0.42967515,TTM 4Q2025,2025-03-31,175239-73T,2014-08-01,0.09047706,Actual,,,Grant,,,Other,,,2014-08-01,Completed,3.27101907,2020-10-27,Seed Round,318344-14T,2025-07-13,0.24470286,Actual,,,Accelerator/Incubator,,,Other,,,2025-07-13,Completed,"The company joined Advanced Propulsion Centre as apart of Mobilise Innovation Accelerator on July 13, 2025 and received GBP 180,000 in funding in the form of grant.",,,https://www.linkedin.com/company/d-risq-ltd,PitchBook Research,https://content.pitchbook.com/profiles/company/443170-45,2020-11-02,d1272cab1679977bccc9243eda3b3cdbc7fcf0d1b7301d617e33727cb0fe50aa,2026-01-14
483883-75,Birtelli's,,,Catering SixFive Limited,"Operator of pizza restaurants and online delivery services intended to serve freshly baked artisans' pizzas. The company offers home-baked pizza kits and fresh stone-baked pizzas crafted from natural ingredients and also offers freshly prepared and portioned home-baked pizza kits, fresh salads, and British beer, enabling consumers to enjoy and customize pizzas as per their choices, delivered at their homes.","customized pizza, food delivery company, food delivery service, food ecommerce, food kits, online food delivery, pizza delivery company, pizza delivery service, pizza restaurant, restaurant chain operator, restaurant marketplace",Formerly VC-backed,2023-02-06,0.68326555,0.500098,GBP,Bankruptcy: Admin/Reorg,2023-02-06,Out of Business,2023-02-06,Venture Capital,www.birtellis.co.uk,6,2022-05-18,Operator of pizza restaurants and online delivery services intended to serve freshly baked artisans' pizzas.,,,2016,,,,,,,Consumer Products and Services (B2C),"Restaurants, Hotels and Leisure",Restaurants and Bars,"Other Restaurants, Hotels and Leisure, Restaurants and Bars",FoodTech,,"Birmingham, United Kingdom",The Silverworks,67-71 Northwood Street,Birmingham,England,B3 1TX,United Kingdom,,,,Europe,Western Europe,1,,4,,,,,,,0.0678366,TTM 4Q2021,2021-10-31,183428-11T,2021-11-12,0.68326555,Actual,4.55516971,Actual,Later Stage VC,,,Venture Capital,,,2021-11-12,Completed,4.55516971,2021-11-12,Later Stage VC,227674-45T,2023-02-06,,,,,Bankruptcy: Admin/Reorg,,,Bankruptcy,,,2023-02-06,Completed,"The company entered into administration on February 6, 2023. The company is no longer actively tracked by PitchBook.",,,,PitchBook Research,https://content.pitchbook.com/profiles/company/483883-75,2021-11-15,5a12a88c6f9328aa3b0b03803351bf212d5f6f444f5ec9c18c74bfe535afad76,2025-09-26
509512-42,iEthico,,Praecanto,iEthico Limited,"Developer of a supply chain software designed to resolve drug supply and shortage issues by using big data and networks. The company have two products; MedSourcing Hub - regulated inverse marketplace for procuring medicines and MedSupply Intelligence - data solution combining disparate sources of public, private and proprietary data, enable to deliver intelligence about the real time medicine supply situation nationally and internationally, it optimize the use of medicines in the supply chain, reducing medicine shortages and waste medication.","drug supply chain, drugs dose, industrial ai, industrial artificial intelligence, medicine supply, supply chain managment, supply chain platform, supply chain system",Venture Capital-Backed,,2.35973518,2.35973518,USD,Generating Revenue,2022-09-27,Privately Held (backing),2022-01-01,Venture Capital,www.iethico.com,8,2025-12-31,Developer of a supply chain software designed to resolve drug supply and shortage issues by using big data and networks.,,,2020,,,,,,,Healthcare,Pharmaceuticals and Biotechnology,Other Pharmaceuticals and Biotechnology,"Drug Delivery, Other Pharmaceuticals and Biotechnology","Advanced Manufacturing, Artificial Intelligence & Machine Learning, Big Data, Digital Health, SaaS, Supply Chain Tech",,"Coventry, United Kingdom",Binley Business Park,Harry Weston Road,Coventry,England,CV3 2TX,United Kingdom,+44 (0)79 2681 8473,,,Europe,Western Europe,1,7,,,,,,,,0,TTM 4Q2025,2025-12-31,295998-04T,2022-01-01,,,,,Accelerator/Incubator,,,Other,,,2022-01-01,Completed,5.96409625,2024-01-02,Early Stage VC,319934-17T,,,,,,Accelerator/Incubator,,,Other,,,,Completed,The company joined West Midlands Health Tech Innovation Accelerator on an undisclosed date. No equity or funding was exchanged as a result of this program.,https://www.facebook.com/iethico,https://twitter.com/iethico,https://www.linkedin.com/company/iethico,PitchBook Research,https://content.pitchbook.com/profiles/company/509512-42,2022-09-28,94b14be79412599332f8069551ab93f838be897b0fcd5e5cd99f484132dc57df,2026-02-11
517540-42,Medmin,,,Medmin Limited,"Operator of a healthcare startup intended to transform private medical treatment. The company seeks to transform the provision of private surgery, providing a tech-enabled concierge service for self-pay, enabling patients to reimagine private healthcare.","healthcare startup, healthcare startups, hospital data, medical treatment data, private healthcare, private surgery",Venture Capital-Backed,2023-07-13,2.58392369,1.975,GBP,Generating Revenue,2023-07-13,Privately Held (backing),2021-07-01,Venture Capital,www.medmin.co.uk,17,2026-03-04,Operator of a healthcare startup intended to transform private medical treatment.,,,2018,,,,,,,Healthcare,Healthcare Services,Practice Management (Healthcare),"Clinics/Outpatient Services, Other Healthcare Services, Practice Management (Healthcare)",HealthTech,,"Birmingham, United Kingdom","3rd Floor, Trigate House",Hagley Road West,Birmingham,England,B68 0NP,United Kingdom,+44 (0)12 1716 9044,,enquiries@medmin.co.uk,Europe,Western Europe,,2,,3.42171052,0.63450752,,,-1.63957454,-1.73751993,0.01680013,TTM 4Q2025,2025-03-31,212015-62T,2021-07-01,0.73531025,Actual,,,Capitalization,,,Individual,,,2021-07-01,Completed,8.12544521,2023-07-13,Later Stage VC,228337-57T,2023-07-13,1.84861343,Actual,8.12544521,Actual,Later Stage VC,,,Venture Capital,"Other - $0,10M",0.09826464,2023-07-13,Completed,"The company raised GBP 1.45 million of venture funding through a combination of debt and equity on July 13, 2023, putting the company's pre-money valuation at GBP 5.00 million. Equity portion of $1.372924 million was raised from Midven, Future Planet Capital and other undisclosed investors. Debt portion of $77,076 was provided by undisclosed lenders. The funds will be used for the growing demand for self-pay private elective surgery and to create 60 new jobs over the next three years will also use investment to complete the technology platform that supports Get Well Soon (GWS), the company's customer-facing brand.",,,https://www.linkedin.com/company/medmin-group-limited,PitchBook Research,https://content.pitchbook.com/profiles/company/517540-42,2023-01-04,4e760ef414e078ae3b51f5ef42d1ed1f9fcb8c4cc5997f056853fb5bacdd4f52,2026-04-01
597493-09,IDenteq,,,IDenteq Ltd,"Developer of data management platforms designed to address fraud detection and data quality challenges in the utilities sector. The company's platform provides subscription-based modules for debt and data quality management, voids and occupier validation, fraud detection and prevention, address monitoring, and commercial data services that aggregate multiple data sources and use machine learning for customer management and revenue protection, enabling utility providers to improve operational accuracy, detect fraudulent activities, and enhance customer data integrity.","data monitoring, data validation, fraud detection, meter data management, revenue protection, risk assessment, utility data management, utility software",Venture Capital-Backed,2025-09-04,1.95457021,1.449994,GBP,Generating Revenue,2024-01-10,Privately Held (backing),2024-01-10,Venture Capital,www.identeq.co.uk,26,2026-02-05,Developer of data management platforms designed to address fraud detection and data quality challenges in the utilities sector.,,,2019,,,,,,,Information Technology,Software,Business/Productivity Software,Business/Productivity Software,"Artificial Intelligence & Machine Learning, Big Data, SaaS",,"Stoke-On-Trent, United Kingdom",Innovation Way,Suite G14,Stoke-On-Trent,England,ST6 4BF,United Kingdom,+44 (0)33 3577 4224,,enquiries@identeq.co.uk,Europe,Western Europe,,1,,,,,,,,0.09068197,TTM 4Q2024,2024-12-31,259327-00T,2025-09-04,1.95457021,Actual,8.39909928,Actual,Later Stage VC,,,Venture Capital,,,2025-09-04,Completed,8.39909928,2025-09-04,Later Stage VC,259327-00T,2025-09-04,1.95457021,Actual,8.39909928,Actual,Later Stage VC,,,Venture Capital,,,2025-09-04,Completed,"The company raised GBP 1.45 million of venture funding from Midven and other undisclosed investors on September 4, 2025, putting the company's pre-money valuation at GBP 4.78 million. The funding will be used to diversify product offerings, and enter new markets along with expanding workforce.",,,https://www.linkedin.com/company/identeq-ltd,PitchBook Research,https://content.pitchbook.com/profiles/company/597493-09,2024-05-14,40f3cda96b8a5d8dd2be91277552665836d7b6987e9731a9f78b9d9617389088,2026-02-11
